作者,段子内容
出门太难,我有个侄子，小学念完就辍学了。十六岁时，嫂子天天催他找媳妇，侄子貌似也有些心动，被我制止了：他现在还是个孩子，找个比他小一点的姑娘，生个小小孩，到时候三个小孩闹腾起来，谁受得了？！嫂子想想有理，遂不提……如今，侄子已快奔三了，还没找到对象……每次见到他，我都得绕路！不为其他的，就因为嫂子天天说，当初侄子要娶的女孩现在是他婶婶——我老婆！！​
夏有凉风秋望月,假期带男友第一次见我父母，表现的很不错。晚上老爸说要和 我男票一起 睡。第二天看到都是黑眼圈的男票，我好奇的问:你这黑眼圈咋回事？？？男票委屈的说:他一个晚上都没敢睡，怕睡着了像搂着你一样不自觉的去搂你爸，谁知道半夜，你爸却搂着我，吓了我更不敢睡，也不敢动[大哭][大哭][大哭]
骑着二哈啃黄瓜,"好久没坐公交车了，末班车，没准备硬币，这还能难得到我？果断投了二十纸币下去，然后开始收后面上车的人的零钱。。。为了收齐18块钱，空旷的车厢我恁是没法坐，站在投币箱前，这都过站7,8站了。。。。更严重的事，还有两站就到终点站了，还差12。。。"
歌歌哒f,"好久没坐公交车了，末班车，没准备硬币，这还能难得到我？果断投了二十纸币下去，然后开始收后面上车的人的零钱。。。为了收齐18块钱，空旷的车厢我恁是没法坐，站在投币箱前，这都过站7,8站了。。。。更严重的事，还有两站就到终点站了，还差12。。。"
小恩的老公8,媳妇昨天生日，我买了L-V包给她！这可是媳妇最想要的，花了我半天工资呢！媳妇眉开眼笑，一边看着包一边问我，这是正品吗？我实说：正品！用了最好的牛皮！我看着皮具店老板娘亲手缝制的！那会有假？……
偷惢,刚恋爱那会，无意间跟男友说喜欢吃农村办大席的菜，没隔几天他就带着我去一家婚宴，随了五百块钱礼，坐下就开吃。期间没人搭理他，我悄悄的问:这是你家什么亲戚啊？男友压低声音:嘘～我根本不认识，你说喜欢吃，刚好早上路过这里，看到有人办婚宴就带你来了。瞬间心里感动，暗叹这样细心的男人值得嫁。后来，感情日益加深，一次酒后他说了实话，那天婚宴的主角是他前女友！
山鹰寂寞飞,刚恋爱那会，无意间跟男友说喜欢吃农村办大席的菜，没隔几天他就带着我去一家婚宴，随了五百块钱礼，坐下就开吃。期间没人搭理他，我悄悄的问:这是你家什么亲戚啊？男友压低声音:嘘～我根本不认识，你说喜欢吃，刚好早上路过这里，看到有人办婚宴就带你来了。瞬间心里感动，暗叹这样细心的男人值得嫁。后来，感情日益加深，一次酒后他说了实话，那天婚宴的主角是他前女友！
姐姐掉沟里了,刚恋爱那会，无意间跟男友说喜欢吃农村办大席的菜，没隔几天他就带着我去一家婚宴，随了五百块钱礼，坐下就开吃。期间没人搭理他，我悄悄的问:这是你家什么亲戚啊？男友压低声音:嘘～我根本不认识，你说喜欢吃，刚好早上路过这里，看到有人办婚宴就带你来了。瞬间心里感动，暗叹这样细心的男人值得嫁。后来，感情日益加深，一次酒后他说了实话，那天婚宴的主角是他前女友！
飞漠刀影!!,楼上的十岁小男孩在上网课，经常有不懂的英语问我，今天他很认真地说要感谢我。我失笑了，你要怎么感谢我?小孩想了一下说，我知道你没对象，你等着!然后蹬蹬蹬跑了。十几分钟后小孩敲门喊:“叔叔开门，我送你个女朋友!”我稳了稳神打开门，小屁孩一脸兴高采烈，往我怀里塞了个半米高的玩具米妮。
老巫婆～～,问闺蜜怎样才能在男神面前显得可爱？闺蜜说：撒娇、卖萌、嘤嘤嘤、用叠词说话！后来我照着闺蜜的话，把男神教的跟我一样了！EMMMM……
净心居士,假期第一次去女友家，一切都比较顺利。女友父母看我也格外满意，我想这次肯定会成了。到了晚上，居然安排我和老丈人睡 一 起。那多尴尬呀，害的我不 敢 深 度 入睡 ，因为我已经习惯抱着女友一起睡。谁又能想到，半夜老丈人一个翻身却把我给抱住了，吓了我到天亮都不敢动，更不敢睡。
天热打鼓球,十八岁那年，我喜欢的女孩给我发来一张小时候家族的全家福，说只要猜出哪个是她，就答应和我在一起。我猜了几次都没猜对！她失望的说，看来我俩是没缘分了，当时我就在妈妈肚子里，这么明显你居然就看不出来！
五少爷的刀,晚饭后去我哥家玩，见我嫂子把上四年级的侄子打得哇哇哇直哭，忙问原因。嫂子气呼呼的说：他写作文说我妈妈头发胡子都白了，身上还在往外长白毛……咋的？我是白毛老鼠精啊？！骂完，继续打。我哥火上浇油说：该打！我看了都觉得瘆得慌，生怕半夜醒来，发现身边躺着个老妖怪！！！这下好了！侄子得救了，我哥遭殃了。。。
夏有凉风秋望月,男友出差在外，视频里对我千叮嘱，万嘱咐说:晚上千万不要一个人出门，不安全。当时我还有些小感动，要不是还没挂视频听到他和同事说的话:还不是我们那条街全是夜宵，烧烤，小龙虾，我又不在，没人拦着她。不知道她回去又胖成什么样了。
空城旧梦她与伞,我结婚那天，穿着帅帅的西装，看着同样打扮的花枝招展的她，心中感慨万分。我们是媒人介绍的，还记得相亲那天，她带着她表妹，我带着我一个堂哥作陪。我正回忆着过去，她款款的来到我身边，轻启朱唇：表妹夫，以后好好对我表妹，要不然我饶不了你。我连忙点头：会的会的，感谢堂嫂百忙之中，还过来参加我的婚礼啊。
(糗名昭著)~魅儿…,这几天加班，就睡在医院宿舍没回家，五一放假，正准备回家让老妈做点好吃的，她忽然打来电话，惊慌的说：闺女呀，天降异象了，小区的猫整夜的叫，傍晚时一群群的鸟在乱飞，怕是要地震啊，我和你爸都吓跑了！我安慰老妈：这都是正常现象，你们跑哪去了？她心有余悸：跑到桂林这边来了，顺便旅个游…我。。。
梅菜扣肉来了,今天买车，不知道使用说明书是电子版的，要登陆网站观看。于是质问销售说，哪有十几W的东西说明书都不给呢？估计当时语气不好，销售顶我一句：你娶媳妇时，丈母娘给你说明书了吗？噎的我白眼乱翻，一个人在风中凌乱……
我是谁∽谁是我,体检，么科候诊。。。。无聊拍个视频发给老婆，配音是：都是成双成对的，就我孤身无人陪伴。老婆秒回：你个傻子，难道那么大医院没有一单身女的，跟她坐一起去，谁会知道你们不是一起的。我。。。。
无书斋主,快一岁的儿子昨天讲话了，第一句话是叫爸爸，我很激动，差点抽他一巴掌！……特么，他不是叫我，是叫一个抱着八九个月女娃娃的帅哥！
小恩的老公8,有点伤感！不知爱情到底是什么？是对是错？昨天本来是个大喜的日子，小叔结婚。只是婚礼上出了点意外，新娘的伴娘竟然是小叔的初恋情人！婚礼照常进行，只是小叔和伴娘趁着大家不注意的时候，悄悄丢下众人开着宝马婚车私奔了……我伤感的是他们开走的宝马婚车是我的，是我的……
兴盛果业,同事接到电话说老婆在医院快生了，我开车送他到医院。同事有点紧张，让我陪陪他，医院信号差，我拿着手机来回找信号。同事又说：“你别走来走去的，搞得好像你是孩子他爹似的！”
石头，剪刀，破布,伙计家嫂子是个热心肠，在个小饭店做帮工，跟老板挺融洽的，头几天老板让嫂子再给饭店找个帮忙的，说店里忙，人手少，再添个人手大伙都轻巧些。嫂子马上回家在村里找了一个赋闲在家的闺蜜介绍给老板，老板也挺满意，当场就把嫂子的闺蜜留下了。现在吧，嫂子的闺蜜在饭店上班了，嫂子让老板炒鱿鱼了……[捂脸][捂脸][捂脸]
歌歌哒f,伙计家嫂子是个热心肠，在个小饭店做帮工，跟老板挺融洽的，头几天老板让嫂子再给饭店找个帮忙的，说店里忙，人手少，再添个人手大伙都轻巧些。嫂子马上回家在村里找了一个赋闲在家的闺蜜介绍给老板，老板也挺满意，当场就把嫂子的闺蜜留下了。现在吧，嫂子的闺蜜在饭店上班了，嫂子让老板炒鱿鱼了……[捂脸][捂脸][捂脸]
天热打鼓球,狗哥年轻时很是豪横，结婚后却被媳妇管得服服帖帖的。我们都不知道为什么。直到一天听他讲：结婚的前几天，准老丈人家说要杀猪，喊他去帮忙。他刚走到门口就只见，一头几百斤的大肥，猪，被老丈人一把按到在地，接着两个小舅子，迅速上前分别按住前腿后腿。最后他女朋友，上前捅刀，抽刀，放血……整个动作如行云流水，一气呵成。
天热打鼓球,小时候，我三婶家大屋和耳房之间有一道后门，后门外是她家的菜园子，山墙顶有一个葫芦蜂的蜂窝。。。。。。。有一天，我和堂弟，还有两个小伙伴在菜园子里捉蟋蟀。看着毫无动静的蜂窝，我一时手贱，掏出自制的小弹弓就打，啪的一声，打个正着。这下子闯大祸了！那些指头大的葫芦蜂全部从蜂窝里钻了出来，扇动翅膀，嗡嗡嗡的向我们扑了过来。堂弟他们三人离后门近，抢先冲了出去，闩上了后门，任我在外面哭爹喊妈，狂呼救命，就是不开！等到他们找来大人，打开后门时，我已顶着个大猪头，瘫在了地上，奄奄一息！。。后来，我爸我二叔三叔他们老哥仨论证了一个下午，得出一个结论：我之所以能够逃过一劫，是因为我皮子太厚，葫芦蜂们蛰不穿！不然，这一窝葫芦蜂，完全可以蛰死一头老牛了！！​
柠檬味的苏打水,刚下班，老爸打电话让回家，说有急事，我忙赶回家，就看桌子上放着两杯果汁，老爸老妈都戴着口罩坐在沙发上，一看到我，老爸就说：儿子快来，我跟你妈打赌呢，谁输了谁做一个月的家务，你快尝尝这两杯果汁哪杯是芒果汁哪杯是橙汁！我一脸疑惑：你们自己为啥不尝老爸瞪我：你妈不信我，说我尝了也会骗她，她又对芒果汁过敏，不能让她尝，只能让你尝了！我忙告诉他我对芒果汁也过敏，老爸大手一挥：我知道啊，不怕不怕啊，你皮糙肉厚的，过敏也没事！
吃了两碗又盛,一个妈妈的智慧。有个大学生姐姐，带着两个小学高年级的妹妹来买文具，这两个小的跟土匪似的，挑了很多东西，放了一堆，我一算，167元。姐姐说不行，妈妈就给了100元，筛下去一些。俩小的都不想把自己要买的筛掉，无法裁决之际，姐姐给她妈妈打电话，她妈妈说，给俩小的一人50块钱，随便花，，，，嘿，问题迎刃而解，俩小的都花了不到50元，还都挺高兴！
绦子,公交车坐够了，准备骑行去单位！下载地图查询家距单位最近距离，忽然发现有智行选项，也就是最聪明的出行方式了吧！打开一看有点毛，因为它建议我坐公交车😓…～
山鹰寂寞飞,公交车坐够了，准备骑行去单位！下载地图查询家距单位最近距离，忽然发现有智行选项，也就是最聪明的出行方式了吧！打开一看有点毛，因为它建议我坐公交车😓…～
五少爷的刀,去城里办事，偶遇一个村里一起长大的发小。几年不见了，听说他过的还不错，自己还开了一个小店，日子过的有滋也有味的，见到我，非常高兴，非要和我一起喝两杯。虽然有事在身，也架不住发小的生拉硬拽的，于是，我便买了些东西跟他回家了。饭桌上，听说我还是单身，就对着他媳妇说，让她把她表姐介绍给我，表姐肤白貌美的，性格也特别好，就是有个小缺点，吃的有一点点多！我心想，能吃是福，这也没啥啊！我就顺口说了一句，有照片没？看看呗？看着发小手机里的膘肥体胖的表姐，我打了好几个寒颤，那一刻，我怂了。。怂了。。。
小恩的老公8,半夜媳妇牙痛，痛的受不了，大喊大叫！家里又没有止痛药。我上网查了快速止痛的方法，就是把牙痛的蛀牙给拔了，一劳永逸！我找了把 大钳子，准备给媳妇拔牙，不成想，媳妇突然抢过大钳子一下子把我敲晕了……
向昨天说再见。,有的时候，老天爷让你结束一段关系并不是没收你的幸福，而是老天爷一直将你的不快乐看在眼里，连老天都心疼你，觉得他不配，所以放你走
姐姐掉沟里了,那年我得了急性肺炎，在医院里整整躺了十天。男友寸步不离守在我身边，端茶送水，嘘寒问暖，关怀到无微不至。出院时，男友整整瘦了一大圈，顶着双熊猫眼，胡子拉碴的，憔悴而又疲惫。我感动得​泪眼婆娑的，埋怨他不爱惜自己的身体，病房里只有我一个人，又不是没床位，咋就不会好好睡一觉呢？男友看着我，有气无力的说：我也很想睡啊！可是你打呼噜的声音惊天动地的，哪里睡得着？！见我不信，男友把手机里的录音放给我听……我吓了一跳！卧槽！里面扯风箱的那个人，真的是我？！我不淡定了。。。​
偷惢,看上了宝马很久了，怕家里人说，瞒着家里人贷款买了一辆，赶上疫情期间没工资入账，贷款逾期了，电话打到我爸那里催债！等我回家后，我爸坐在沙发上一声不吭看着我，过了一会默默的打开了地下室的仓库，指着仓库说到：这是你妈前些年囤的几吨金条，拿点去换了把贷款还上吧……
-小门神~,我做了一个滑翔机，跟平时遮阳伞一般大小！为了测试滑翔机的稳定，我把老妈养的宠物猪绑在下面！我从二十层高天台，慢慢放下滑翔机！滑翔机下的猪空中一声惨叫，不久后平安落地！为了我自身安全，我决定再对猪做一次实验！惊魂未定的猪，说啥也不让我再绑一次！那头猪咬了我一口，接着毅然决然撞在路边一棵大槐树上，生 死未 卜……
姐姐掉沟里了,二十岁那年，和初恋分手了，痛不欲生。我把自己锁在房间里，睡了哭，哭了睡，整整三天没出来。谁敲门也不开。第四天早上，我妈拍着房门喊：丫头，快出来！XX(我男友)来了！我从床上蹦起来，赤着脚，拉开房门，连声问：在哪里？在哪里？我爸从大门口进来，气呼呼的说：被我放狗撵跑了！我一听就哭了：爸，你真是我亲爸啊！你咋不让他进来呢？我爸火了：哭什么？他是带着他女朋友来的，说是来还你织给他的毛线衣！！
无书斋主,本人读书时跳过级，初三英语老师指桑骂槐的在课堂上说：某些人别以为厉害，跳级得跳得好，成绩不行跳了也是害人！！我很恼火，你不是瞧不起我吗？看我怎么扫你的脸！于是，我拼命的攻英语……月考的时间，我英语成绩全校第二，她宣布的时间，我昂起了头！英语老师：某些人别以为英语跟上来了就可以抬起他那孔雀头，其他的不行别以为我不知道！！……我不得不低下我昂起的头，因为除了英语，其他的我都是五十多分！！
五少爷的刀,抱着小侄女举 高 高，逗得她一直笑个不停。后来有些累了，我就把小侄女往肩膀上一扔，准备扛抱着她回家。谁知道乐 极 生 悲，力气用大了，直接把小侄女扔出去了，脑袋先着地，磕起了很大一个犄 角，疼得哇哇哇直哭。。。。
歌歌哒f,和我哥一家出去玩，回来时嫂子说想练下车，于是我和侄子坐后面，我哥坐副驾驶，起步时有点小坡、车抖几下就熄火，抖几下就熄火，一连好几次车没往前开反而倒退了……我哥：要不你加点油，嫂子深吸了一口气然后又重新打火，期间我们大气都不敢出，就在离合放的差不多时嫂子突然一脚油门下去车都跳了起来，吓的侄子连忙抓着我喊：抓紧了！要起飞了……
柠檬味的苏打水,早上我出门上班，隔壁王叔的孙子提一个大垃圾袋要下楼去扔。我说顺便帮他带下去扔。晚上我回来才知道这屁孩子把课堂作业都塞垃圾袋里了，王叔气急败坏，我才想起来我开车锁，把袋子放墙角忘记丢了，赶紧跑下去提上来。果然小孩说话不算数的，那小子早上还说要认我做大哥，现在就扬言从此跟我绝交！
吃了两碗又盛,本地水稻快要插秧了，雇工却遇到困难，就连卷秧盘都炒到400一天了。刚刚社区群里又有人发招工信息，我评论了一句:今年应该不缺人啊，大学生现在都在家呢！有人回我:我儿子自从上了大学，不到中午都起不来。
义行天下7,记得有次下班几个要好的同事聚会，吃饱喝好后，大家纷纷学起了我们领导张总的口语，我也站起脸一拉双手掏口袋道:你们这些人天天就知道瞎几 把搞！不好好上班！下 面掌声四起，，同事们纷纷夸我学的最像，当我正心里美滋滋的享受夸奖的乐趣时，他们竟然一致表示如果我能再给他们加点工资那就更像了……卧槽……
义行天下7,带儿子去逛商场买玩具，许久没逛，儿子在商场里疯 跑啊，突然儿子在不远处喊到:爸爸快来看呀，看这是怎么回事？我以为儿子又发现什么好玩的玩具了，边走过去边说:宝 贝，看上什么尽管买！谁知儿子望着那一排搓衣板说:爸爸，你看这搓衣板跟咱家的是不是不一样？我:哪里不一样？都是一块搓衣板！儿子:咱家那块搓衣板上有两个“圈 圈”，那两个“圈 圈”还很光滑！你看这些都没有！卧槽，把我气的，特么还想要玩具，走回家……
孤心傲月,昨天，刚确定关系的女朋友家庭聚会，非要让我去露露面，认识一下她家的人，也顺便考察考察我……不能割，快有用了……吃的差不多，喝的也差不多的时候，女朋友起身去洗手间了，她妈马上凑过来跟我悄悄的说，这闺女还没谈过恋爱，她啥都不懂，你该搂就搂，该抱就抱，不用不好意思，多教着她点…
吃了两碗又盛,一个月前我发了个帖子，说媳妇吃饭时讲她小时候不吃辣椒，她妈妈拌凉菜偏放辣椒油，，，，，割，，，，我刚刚炒酸辣土豆丝时才突然觉醒，我媳妇那时的意思是不是让我炒菜少放辣椒？
leo咫尺天涯,无聊在家和侄子玩脑筋急转弯，他问我答。　侄子：“什么情况下，一加一等于一？”　　我：“算错的情况下。”　　侄子：错，一群羊加上一群羊的时候。再问，什么情况下，一减一等于一？”　　我：一群羊减一群羊的时候。”　　侄子：“那是两群羊了，应该是算错的时候，继续问，什么情况下，一乘一等于一？”　　我想了很久：“不知道。”　　侄子：“你笨呀，一乘一本来等于一呀，你这么傻我奶奶知道吗？”　　我崩溃的说：“应该不知道。”　　老妈神奇的出现在我身后补刀：“不，我知道！”
千丝雨ベ万人迷,小时候晚上，经常搬个小板凳，拉着妈妈去看星星，让她给我讲星座的故事。有一天是阴天，晚上没有星星，我缠着妈妈:我要听星座之神宙斯的故事!妈妈笑:现在没有星星，我看不到星星，怎么给你讲星座的故事啊！我把藏身后板砖拿出来，对着自己脑袋就是一下:好多星星，妈妈，你看到了吗？快给我讲故。。。
石锅拌着饭,偶然看见电视里冷战时亲老婆一口可以立见奇效，我立马心花怒放的冲进房间掀开老婆被子就亲了下去。可是忘了昨晚老婆为了撵我出房间把小姨子叫来作伴……不说了，我得去医院看看这两颗牙还能安回去不！
山鹰寂寞飞,偶然看见电视里冷战时亲老婆一口可以立见奇效，我立马心花怒放的冲进房间掀开老婆被子就亲了下去。可是忘了昨晚老婆为了撵我出房间把小姨子叫来作伴……不说了，我得去医院看看这两颗牙还能安回去不！
冰清素云,偶然看见电视里冷战时亲老婆一口可以立见奇效，我立马心花怒放的冲进房间掀开老婆被子就亲了下去。可是忘了昨晚老婆为了撵我出房间把小姨子叫来作伴……不说了，我得去医院看看这两颗牙还能安回去不！
空城旧梦她与伞,说一说我小叔叔的事，他从小就喜欢音乐，可是当时穷，哪里有钱买乐器啊。他自己就用竹子做笛子，用泥巴做 哨 子，用三片树叶都能吹 出一首歌。我爷爷常常苦口婆心的劝他，要他好好读书，长大后才能找到好工作。我小叔叔却总是回答，他以后一定要在音乐方面出人 头 地。三十年过去了，我小叔叔现在是十里八乡最有名气的，红 白 喜 事 唢 呐 手。有志者，事竟成！！
夏有凉风秋望月,侄子:红色加白色等于粉色，那辣椒油加白开水，为什么不变成粉色呢？我:傻孩子，白开水是透明的，牛奶才是白色。侄子:那我试试辣椒油加牛奶!我:别试了，我知道，等于拉肚子!
姐姐掉沟里了,侄子:红色加白色等于粉色，那辣椒油加白开水，为什么不变成粉色呢？我:傻孩子，白开水是透明的，牛奶才是白色。侄子:那我试试辣椒油加牛奶!我:别试了，我知道，等于拉肚子!
芭蕉窗下听雨声,老公打电话叮嘱我说：亲戚来了，别吃凉的。正在喝啤酒的我忐忑的说：要不，你回来把啤酒热下？[捂脸][捂脸]
雪里黄蓝绿,老公从过年到现在一直上班，可能是累着又上火，鬓边起了两个大痘，又痒又疼的。昨天休假，干脆就剃了光头。一到家，我打趣他，大师，好久不见呦！老公抿嘴一笑，单手作揖：阿弥陀佛。我哈哈笑起来，旁边的闺女拉着我进了卫生间，着急问：“妈妈！爸爸怎么是和尚？难道我的爸爸不是他？”
我是谁∽谁是我,前几天在老家，老妈要跟侄儿视频，内容如下，老妈：大孙子出去两月了，挣多少钱了？侄儿：奶奶你能不要整天就问挣多少钱好吗？你不是应该问问我谈没谈女朋友吗？：那你谈女朋友啦？：没！现在姑娘不好骗了。：没谈女朋友，不问你挣多少钱，我问什么？： 可以问我吃的好吗，休息好的。：一个单身狗，一人吃饱全家不饿，一人关灯全家休息了，有啥好问的。：奶奶咱还是聊聊挣钱吧。。。。。。。。。。。。。。。。。。。。。。那个啥？我就想知道，一个八十多岁的农村老太太怎么会知道《单身狗》这个新名词的？
老巫婆～～,今天买了个包，挎在肩膀得瑟地冲男友眨眨眼。“包好看还是我好看？”男友：“都好看，好看的我想犯 罪!”我勾 勾 手 指：那你 来 呀～于是男友激 动地上前一把摁住我的包，从里边拿了一百块钱说：我要去买烟！我…我特么……
放弃or被放弃,三年没联系的土豪大学同学问我：“二手的玛莎拉蒂30万要不要，我才开了三个月。”我说：“你没事吧？倒卖二手车去4S店。 ”他说：“我懒得跑，你开个价，我觉得能卖就卖给 你。”我心一横，说：“5万。 ”他：“我三个月前买都花了100多万，你才给5万？加点 呗。”我：“我手上就5万，多我也没有了。”他：“成交，卖你了。”
诸葛思慧,开学了，一个学霸居然把寒假作业全写完了。但是他在寒假作业的最后加了一段话:我这个作业里面有30个错题和三十个错别字，希望老师把这些错误都找出来，千万别用一个“阅”换我们一个月!
骑着二哈啃黄瓜,上司在公司自动售卖机，买凉茶，投币进去，选择好商品，但是商品没掉不来，没反应。。。我路过，刚好看到，我走过去，用力拍在售卖机上:欠揍，她是我老大，你也敢不敬，。。。咚的一声，凉茶掉了出来。。。上司一时间都懵了。。。然后我讪讪解释:就得凶一点，这机器比较狗。。。不过我打死不会告诉上司，这机器传送系统有点问题，容易卡住商品。。。。
