作者,段子内容飞漠刀影!!,上火，嘴边起了个大疖子，说话都要慢点说。我去社区医院拿药，碰上隔壁楼的大牛也来拿药，他手膀子破皮了。我问他怎么了，大牛说他爸买了个大坐扇扛着回来的，到家才发现坐扇脑袋不见了…我说然后你出去找摔跤了？他说：“我出门之前没忍住，笑出声了。”玛德我也没忍住！疼死了！！
五少爷的刀,昨天晚上喝多了，睡到半夜突然发了疯，跑到大街上拦了辆出租车，告诉师傅送我去潍坊。师傅很好奇：大半夜的，去潍坊干啥呢？我想了半天也不知道我要去干什么，只好说：你帮我想想。师傅说：找你女朋友？我大喜：对对对。是这个理由。可是……我没有女朋友啊！师傅停下车，打开车门，一脚把我踹了下来。。。
聊天不撩妹子,楼下小超市买烟，老板俩口子不在，他家的上三年级的孩子在收银台上写作业，就让他给我拿包烟，他抬头看看我，说卖东西不是他的事，他只负责看店，不负责卖东西。他低头从台子里拿一条给我道：马伯伯借一条给你都行的，卖不行。我问：借行？为啥卖不行？他：马伯！你有烟抽就行了，问那么多干啥？银钱不过手知道吗？再问不借你了！你以为我不想收钱吗？还不是妈妈说售货款老差，爸爸非说是我拿的吗！！！我。。。
出门太难,楼下小超市买烟，老板俩口子不在，他家的上三年级的孩子在收银台上写作业，就让他给我拿包烟，他抬头看看我，说卖东西不是他的事，他只负责看店，不负责卖东西。他低头从台子里拿一条给我道：马伯伯借一条给你都行的，卖不行。我问：借行？为啥卖不行？他：马伯！你有烟抽就行了，问那么多干啥？银钱不过手知道吗？再问不借你了！你以为我不想收钱吗？还不是妈妈说售货款老差，爸爸非说是我拿的吗！！！我。。。
出门太难,我有个侄子，小学念完就辍学了。十六岁时，嫂子天天催他找媳妇，侄子貌似也有些心动，被我制止了：他现在还是个孩子，找个比他小一点的姑娘，生个小小孩，到时候三个小孩闹腾起来，谁受得了？！嫂子想想有理，遂不提……如今，侄子已快奔三了，还没找到对象……每次见到他，我都得绕路！不为其他的，就因为嫂子天天说，当初侄子要娶的女孩现在是他婶婶——我老婆！！​
夏有凉风秋望月,假期带男友第一次见我父母，表现的很不错。晚上老爸说要和 我男票一起 睡。第二天看到都是黑眼圈的男票，我好奇的问:你这黑眼圈咋回事？？？男票委屈的说:他一个晚上都没敢睡，怕睡着了像搂着你一样不自觉的去搂你爸，谁知道半夜，你爸却搂着我，吓了我更不敢睡，也不敢动[大哭][大哭][大哭]
撞死一只羊,老板在开视频会议时不小心打开了滤镜，把自己变成了一颗土豆。因为不知道怎么关掉滤镜，整场会议，他都被困在土豆里……
吃了两碗又盛,给小外甥苹果，他不吃，就像唐僧见了人参果。我纳闷了，这孩子原先挺爱吃苹果啊？小外甥眼皮一马达:你忘了，去年你给我一个苹果，我一咬，门牙都硌掉了！这好不容易长出来新牙，可不能吃你家苹果了。我[捂脸][捂脸][捂脸]
飞漠刀影!!,同事借宿在我这好几天了。我委婉提醒他天热，两大老爷们挤一张床，难受。他说他不敢回家。五一在家帮忙干农活，在地里不小心踩滑了，糟蹋了一大片玉米苗，他爸说要打断他的腿。我很惊讶，这点小事，你亲爸对你这狠？同事：“也不狠，要是我儿子干坏事还逃跑，害的我踩到钉耙的齿上，我也要打断他的腿的。”[流鼻血]
男渣医生医渣男,和老婆大吵一架后和好了，老婆说：“这次真的要被你气死!要是再有一次就离婚!两个孩子都不给你!”我嬉皮笑脸的说：“那样孩子会想我、会不愿意的。”老婆说：“那我就骗他们说不是你亲生的!”
诸葛思慧,厂里机器坏了，报修了，人家因为疫情来不了，我闲着没事捣鼓捣鼓就好了，干了一天活儿后，副厂长找我谈话，因为破坏厂里规定罚款500，出于个人感谢又奖励2500，让我好好干。
姐姐掉沟里了,厂里机器坏了，报修了，人家因为疫情来不了，我闲着没事捣鼓捣鼓就好了，干了一天活儿后，副厂长找我谈话，因为破坏厂里规定罚款500，出于个人感谢又奖励2500，让我好好干。
无书斋主,今晚到爸妈那吃饭，老妈做了一桌很丰盛的菜，准备吃的时间，老爸突然生起气来，横鼻子竖眼睛的把我骂了一顿……说真话，我有点懵……就在我快憋不准顶撞几句的时间，老妈从厨房拿了瓶米酒，晃了晃对老爸说：米酒可以喝点，高度白酒想都别想，骂也没用……唉……我爸喝着米酒把我骂了一个多小时，怪我没给他买高度白酒！！
空城旧梦她与伞,老丈人过来城里玩，我要接风洗尘，媳妇说农业生态园里，有一家新开的野菜馆，味道很好，而且是绿色食品，健康。到了那里，饭馆装修的挺豪华，我们都以为可以大吃一顿啦。等服务员一盘盘的上了菜，老丈人生气的拍着桌子，指着媳妇骂：死妮子，我大老远跑过来，你就让我吃这个？你仔细看看，这几样菜，哪一样不是你小时候扯过的猪草？
记忆那一抹微笑う,年前，有次跟女友聊天吵架了，我声情并茂的骂了她一顿，人家直接把聊天内容截图保存了。这不，两个月不能出门，她只要心情不好，想吃零食就把保存的截图看一遍。然后，她就狠狠的揍我一顿！！！
小恩的老公8,女人心，海底针，媳妇下班回来就和我闹，整整闹了一个多小时，媳妇从天南海北扯到全球气候变暖，从我俩第一次见面到如今七年之痒，我终于弄明白了，媳妇下班有个学生问路的时候喊她一句阿姨……
小恩的老公8,单位附近新开了家面馆，就带女朋友去吃，觉得味道一般。有天女朋友和我闹脾气，我一个人去了这家面馆，吃完付钱的时候老板娘神秘兮兮的和我说：这位小哥，你来之前，我看到你上次带的那个女的和一个帅小伙过来吃面……我一听，很是感谢老板娘，以后每次交女朋友都先带去老板娘店里吃饭！后来换过十多次女朋友了，老板娘也看不过去了，特意让她的女儿嫁给我……
雪里黄蓝绿,闺女每天早上都在电脑上晨读，然后用手机录音拍照去群里给老师检查。今天电脑居然断网了，晨读错过了，导致我被老师点名批评没督促孩子。中午跟老公视频时，我觉得委屈，老公很诧异说非要在电脑上读？前天不是发了课本吗？哈?妈耶我忘记了……老公问，孩子也忘记了啊？我转头问闺女，熊孩子转着脚丫子在看电视：“我没忘记，我不提醒你，我就可以少上一节课呀！”
飞漠刀影!!,闺女每天早上都在电脑上晨读，然后用手机录音拍照去群里给老师检查。今天电脑居然断网了，晨读错过了，导致我被老师点名批评没督促孩子。中午跟老公视频时，我觉得委屈，老公很诧异说非要在电脑上读？前天不是发了课本吗？哈?妈耶我忘记了……老公问，孩子也忘记了啊？我转头问闺女，熊孩子转着脚丫子在看电视：“我没忘记，我不提醒你，我就可以少上一节课呀！”
坏小孩cium,自从有历史这门学科开始，我就从来没及过格，可怕的是历史老师还不放过我，让我初中三年当了三年历史课代表，怎么求都没用，那种课代表还不及格的痛苦真是无以言表。更更可怕的事，高中了，高中，历史老师不知道为啥又一眼就相中了我，又特么按着我当了三年历史课代表，而我。。。历史依然不及格。。。
花落彼岸～任逍遥,我侄女是幼儿园老师，她女儿归她教，别的孩子在幼儿园里哭找妈妈，小家伙倒好人家哭天喊地的找爸爸
吴鑫卞布慧授伤,站凳子上取东西，忽然脚下打滑摔了下去，这时老板连忙跑了过来，我脑海里顿时想起女主被男主接住转圈圈的画面。老板扶住我，问：你怎么摔倒了？我激动的说：我没事，我没事刚刚头晕了一下。就刚刚，老板觉得我体质不好，不适合做这份工作，给我工资结了。。。
五少爷的刀,表妹来找我，说她哥在北山村包了点活计，叫她去帮忙做几天饭。那里偏僻，她一个人不敢去，叫我送她。我把表妹送到目的地后，表妹从包里掏出个红色的塑料袋给我，说：里面有一双鞋垫，我亲手做的！送给你垫吧！我笑笑，接过来往兜里一揣，骑上摩托就回来了，到家打开一看，傻眼了：两只鞋垫背靠背用红丝线捆在一起，还打了个同心结！鞋垫上，分别绣着爱你两个字！肯定是绣给她男朋友的！拿错了！我嘀咕一句，跳上车，把鞋垫送回去还给了表妹，好奇的问她，她男朋友是谁，哪里人。表妹沉默了一会，顺手把鞋垫扔进灶膛里，烧了。。
五少爷的刀,那年和初恋分手后，我郁抑成疾，满脑子只会想着如何寻找一种华丽而悲壮的方式，来给我短暂的一生划上个句号。在衡量了世人自裁的种种憋端后，我产生了一个神奇的想法：买块豆腐撞 死得了！于是我来到了大街上，趁着豆腐摊老板不注意，跳起来，一头向那块磨盘大的豆腐撞去。。​那一天，我一举成名，成了一个天大的笑话！！
天热打鼓球,小学时，我和另外两名同学一直是班里倒数前三名。我们仨十分团结，成绩稳定不说，动手能力还强，经常和同学打成一片，人送外号——铁三角。后来老师只用了一招，就瓦解了我们的铁三角：一次考试后，他让我们中成绩好的那个，打另外两个人的手板，并说，下次还这样！
(糗名昭著)~魅儿…,感冒快好了，和闺蜜去医院最后一次输液巩固下，男护士长的很帅，在我手背啪～啪～啪打了三下，闺蜜偷偷告诉我：他对你有意思，这三下是暗示夜里三点他下班，你一定要在门口等他。宁杀错不放过，寒风冷冻守到三点，毛都没见着，又冻感冒了！
胖香,楼下有个脑子不大明白的小哥哥，人特别善良可爱，就是有一点不好，每天一大早就拎着他妈妈跳广场舞用的大音响，在楼下放音乐，那高亢的：“在你的心上，自由的飞翔……”一响，都能把在睡梦中的我送走！今天早上不到7点又开始了，我拎着刀正准备夺门而出，我妈蹭的窜出来骂我：“自己懒还怪别人，你要是敢把这起床铃吓跑，我跟你没完！”
无书斋主,人逢喜事精神爽，接到正式通知，我这个千年老二转正了！！……虽然内心无欲无求了，但在这突然来的惊喜面前，我还是掩饰不住内心的激动……老朋友老同学老兄弟准备一个一个通知，庆祝下！！……砰，屁股上挨了一脚:崽饿了，泡奶粉去！……现实照进梦想，我……我特么是做了个梦！……
雪里黄蓝绿,前几天傍晚，跟老公在小区旁的公园里遛弯时他说长胖了，肚子都大了，我开玩笑说，呦都三个月了，再半年就可以生了。第二天我去买菜，碰上隔壁楼的一个阿姨，她说你怀孕了？恭喜恭喜啊，我说没有，阿姨一惊一乍的，你身体出问题了？难怪这么久了不生二胎…我都来不及说话，不远处有人跟她说话，她就走了。前两天老公告诉我，小区里有人叫他送我去医院。哎呀懒得理这些了。昨天我下楼拿快递，门卫大叔一脸怜悯对我说：“可怜的娃，这么年轻就得了绝症，唉～”我？？？？？！！！！！[捂脸][捂脸][捂脸][捂脸]
倾心倾情%%,小阮说:记得好多年前老公给我买了个手链，一千来块钱。他说几十块，马德第二天我就丢了。直到几年后我发现了小票，才来了一次迟到的哭泣。你真好骗[捂嘴]
老巫婆～～,跟男票吵架，我一激动把“滚”说成“呱”，还连续说了三次“呱 ，呱，呱”！我…………
青梅无关竹馬,清明去祭拜，小侄子祭拜完还给旁边的公墓磕头，问他为什么，他说要搞好邻里关系
夏有凉风秋望月,前几天，我遇到了念念不忘的前男友，那天我和闺蜜在逛街，闺蜜眼见，扯着我的手臂说，月月，你看那个是不是你的前男友？顺着闺蜜的手指看去，我正看见前男友正在往我们这边走来，眼光情深意切，我以为是前男友找我复合的，心里就像乱撞的小鹿，前男友走过来，跟我说，月月，几年不见，你还好吗？前段时间出差买了一个礼物，想送我女朋友，你帮我参谋一下，她会不会喜欢？
我是谁∽谁是我,前几天，我遇到了念念不忘的前男友，那天我和闺蜜在逛街，闺蜜眼见，扯着我的手臂说，月月，你看那个是不是你的前男友？顺着闺蜜的手指看去，我正看见前男友正在往我们这边走来，眼光情深意切，我以为是前男友找我复合的，心里就像乱撞的小鹿，前男友走过来，跟我说，月月，几年不见，你还好吗？前段时间出差买了一个礼物，想送我女朋友，你帮我参谋一下，她会不会喜欢？
芭蕉窗下听雨声,最近连续阴雨。眼看隔壁小区的野菜越长越老，心痒难耐的我今天终于冒着小雨动手了……当提着一包野菜的我心满意足的回到家时。坐在沙发上的老公看着湿漉漉的我，皮笑肉不笑的说道：小妹啊！你说你当初学习但凡有这一半的劲头，也不至于落到今日挖野菜的地步啊……[捂脸][捂脸]
无书斋主,中午，小李来我办公室叫我:正哥，刘嫂和小王在食堂打架了，你去处理下！！……我赶到食堂时，发现她们两个只是骂街，就随口说了句:打不打，不打就散场，影响大家休息！……特么，我话一说完，真打了！！……
石头，剪刀，破布,吃完早饭，看到女儿屋的床铺还没有整理，就训她，以后早上必须整理。她还犟嘴:“妈妈，我早起收拾好了待会睡午觉还得弄乱，我还费那个劲干啥呀。”呵呵，貌似她说的还挺有理……[疑问][疑问][疑问]
大爱浇水,都长这么大了？有对象了没？咋没开车回来？——来自邻居的亲切问候…
芭蕉窗下听雨声,家里洗衣机坏了，就新买了一个。当时带了皮尺量了尺寸，可回来后就不能进洗手间了。（因为洗衣机的管道和电线没量进去）委屈的打电话跟老公诉苦。老公说：找你妈妈！我莫名其妙的说：找我妈干啥？她也解决不了。谁知这货淡定的说：“我要退货”[捂脸][捂脸]
吃了两碗又盛,媳妇从外面回来，神情沮丧，目光黯淡，我问她怎么了，她说:我身份证丢了。我:没关系的，补办也花不了多长时间。媳妇:又找着了，有人捡到拍照发社区群里了。我:那你怎么还不高兴？媳妇:群里有个大爷上来就问，‘身份证上这是姑娘还是小伙啊？’
吃了两碗又盛,去卖废纸箱，应得37元，废品站的老板娘抬头看了看天，然后递给我一百元，让我给她找零。这我哪有啊，让她微信转给我，她说:手机留家里给孩子上网课了，不然我去换零钱你在这等着？我同意了。老板娘换了身干净衣服跑出去了，她前脚刚走，天就下雨了，淅淅沥沥下了四十多分钟，雨停了老板娘才回来。后来，我脑瓜子突然嗡了一下，我那时是不是给人家看店了？
依丽若水,不太紧张了，逛逛吃个小饭。天热人又不多，就没戴口.罩。。正说的热闹，忽然老公眼直了。我转头去看，美 女一枚、白皙纤瘦，穿着吊带的修身裙子，竟然还挺沣 满。回头看老公，却飞快把口.罩捂在嘴上。我噗呲一笑“没想到，你敬.惕性还挺高的”他含糊不清嘟囔：“丽丽，我怕我流哈喇子直接流下来…”[捂脸][捂脸]尼煤的
吃了两碗又盛,媳妇半月前发现了个购药平台，给我买了去扁平疣的药膏，我天天涂抹，感觉脸上的疣体快掉了，心里挺高兴。昨天又到了三盒胃药让我吃，我就奇怪了，我胃口这么好，哪来的胃病？媳妇解释说:你吃就完了，打特价呢，买两盒赠一盒，我听了隐隐有些担忧
夏有凉风秋望月,小姨昨晚说给我介绍一对象，今天要带来家里看看！老妈特别开心，叨咕着，能不能嫁出去就看这一个了……这不，一大早上，跟着老妈去市场买菜，我拉着小车跟在老妈后面走，市场的人还真是很多，老妈也买了一大堆好吃的往我的小车上放，我就低着头玩手机，一不小心，我踩到一个人的脚，出于本能，连忙说声对不起，那人一边跳着脚，一边咧着嘴说没事儿，还关心的问我有没有硌到脚？……我以为是我的春天来了，一抬头，居然是前男友……
a依然美好,每当我想知道这个月有没有31号时，就会在心里默念“一三五七八十腊，三十一天永不差”。[捂脸]
人间十月雪,每当我想知道这个月有没有31号时，就会在心里默念“一三五七八十腊，三十一天永不差”。[捂脸]
晴～风,人家17岁就当网红，开超跑。我三十几岁还在群里抢0.01的红包，忘了说谢谢被移出了群聊～
冰清素云,前几年碰到学生时期追我的一个男生（小林），跟他打过招呼后，小林看着我说:这么多年没见，看你变化挺大的，早知道等你毕业再结婚了（他后来没上学），现在想想真是有点后悔。我赶紧安慰他:别责怪自己了，过去的事儿就让它过去吧，你现在孩子都有了，多幸福啊，不像我，还是单 身 狗一个。小林听了哈哈一笑:你还单身啊，那我更后悔了，早知道今天把我老婆孩子都带来，让你看看什么是幸福一家人……
花落彼岸～任逍遥,我老爸喜欢喝酒，小时候有一次给我钱让买二斤zhu 肝 下酒，结果我买回来还挨顿揍，一边打我一边骂:“让你买下酒菜你买个竹竿，你是不是知道我要打你而没有趁手的东西呀……
沃土秋实,最合适的婚姻:一屋两人，三餐四季，狗在跑，我在闹，你在笑。夏天的傍晚一起散步，回家的路上顺手买一个西瓜，你说“太重我来提吧”。
夏有凉风秋望月,老爸老妈二十多年了一直相敬如宾，从来不        见他们吵架。我问老妈：你和俺爸咋保持的？老妈笑着说：还不是因为你？我发火会揍人，就想打你，你爸马上认怂！反之，惹你爸生气了，你爸想打你，我马上认错！……哇噻，想不到老爸老妈对我这么好！老妈停顿了一下又说：我们当初不小有了你，然后一致决定把你生下来，没事揍着玩！直到有一天，发觉不能再打了，再打就傻了，嫁不出去了……
石头，剪刀，破布,今天早上村里大喇叭喊以后村里要实行火zang了，上午街上一群老头老太太聊天，打赌看谁能先去见马克思，挣那个村里补贴的前十名的三千元钱💰奖励。
义行天下7,老婆买了两个炸 鸡 腿，给十二岁大儿子一个，然后又给五岁儿子一个，说是不偏不向，公平对待！一会老婆说地板脏了，让大儿子吃完鸡 腿把地板拖一遍，大儿子满脸不悦道:妈妈，既然对我和弟弟一样看待，那地板一会我和弟弟一人拖一半吧！熊孩子真会扯……
空城旧梦她与伞,初中时，家里养了一条小黑狗，每天我放学时，它都会跑到校门口接我。那天，家里煲了排骨，小黑一直围在我身边摇头摆尾，想吃骨头。可那天是用高压锅煲的排骨，骨头都煲烂了，我是连骨头都啃啦，没吃到骨头的小黑，哀怨的望了我一眼，走了。第二天，小黑仍然和往常一样，来校门口接我，我看时间还早，和几个同学约着去网吧打一盘游戏。小黑在网吧外面转了一圈，不见了，我也不以为意。半小时后，小黑回来了，后面跟着一个女人，一个拿着竹棍，怒气冲冲的女人。
姐姐掉沟里了,儿子说他不想和英子好了。英子说了，如果他长大了敢不听话，就要揍他，还要让他跪搓衣板，跪石子，跪瓦渣……我看着儿子气鼓鼓的小脸，很是无语：你是个男人诶！怎么能怕一个女人呢？儿子反驳说：我爸爸不是男人啊？还不是你想打就打，想骂就骂，你让他跪着，他都不敢站起来！停了停，儿子又说：如果英子长大了，比你还恶，我就si定了！！！
诺诺真漂亮,老爸在玩手机，我凑过去看，刚好看到系统推荐的几个认识的人，老爸一一点了关注，就是没有关注我，我急了：爸，爸，你看，刚刚你划过去那个人是我，是我，你咋不关注啊！老妈在一边说：知道是你！你爸说，他的几个老伙计天天在一块没事就刷，人家都晒闺女，人家闺女好看的不得了，就你最丑！他都不好意思关注你，对了，你爸关注了你舅舅家那个小表姐，就最漂亮那个，天天对外吹嘘是他闺女呢，你一会出去捂严实点，别被楼下你爸那几个老伙计看到啊！
-小门神~,老爸在玩手机，我凑过去看，刚好看到系统推荐的几个认识的人，老爸一一点了关注，就是没有关注我，我急了：爸，爸，你看，刚刚你划过去那个人是我，是我，你咋不关注啊！老妈在一边说：知道是你！你爸说，他的几个老伙计天天在一块没事就刷，人家都晒闺女，人家闺女好看的不得了，就你最丑！他都不好意思关注你，对了，你爸关注了你舅舅家那个小表姐，就最漂亮那个，天天对外吹嘘是他闺女呢，你一会出去捂严实点，别被楼下你爸那几个老伙计看到啊！
撞死一只羊,同学找我，说他老爸住 院了，向我借两千应急。刚转完钱，我惊讶地看见他老爸迎面走来！于是问他：阿叔，你儿子……话还没说完呢，他老爸急着说：别提了，他住院了！对了，可以借我两千吗？
吃了两碗又盛,媳妇生气不理我，我也不理她。她拿出一袋核桃，找到核桃钳子啪在旁边，徒手剥壳，一捏即裂。听着核桃的碎裂声，我突然想到男人还是应该气度大一些，和谐家庭从我做起，，，，
捡尸大队大队长,昨天下午闲来无事在公园旁溜达。突然，路边一擦皮鞋的大姐叫住了我：帅哥，擦下皮鞋吧，只要5块钱！我面露难色：可……可我鞋子是上星期刚买的，新着呢……但转念一想，每个人生活都不容易，通过自己辛勤劳动赚的钱都值得让人尊重！就当做善事吧。擦就擦！ 我坐在小板凳上，大姐拿出抹布，鞋油……娴熟地擦了起来， 片刻只见大姐眼眶湿红，一边抽搐着鼻子一边说：帅哥，你得多加3块精神损失费给我呀！你这鞋真特么辣眼睛！ 我：……套路，全是套路……
逗b聚乐部,人死了，就变成一个星星。干嘛变成星星呀？给走夜道儿的人照个亮儿……致敬英雄
空城旧梦她与伞,邻居家昨晚杀猪，送了我家一点肉，一点猪血。打算早餐做个猪血粉。在厨房里一不留神，手指被刀划破了一点皮，有两滴血落在了猪血里。痛的我哎哟一声，六岁的女儿听到声音跑过来，看到这情景疑惑的说道：爸爸，这是不是电视里放的滴血认亲啊？你和这只猪是不是亲兄弟啊？
吃了两碗又盛,大姐过生日，我和姐夫去买菜，顺便订个蛋糕。蛋糕师问做什么造型的，我想了一下说:我姐姐属猪的，做个猪的造型放在中间，周围花朵点缀一下，再写上生日快乐。姐夫听完点点头:就这么做，，嗯，做个母猪，，我媳妇是女的。
出门太难,以前喜欢上了本厂的一个女工，不敢表白，就央求当质检员的表哥帮忙撮合下，并且托他捎去我写的好几封情书！。。几年后，我去表哥家看望二姨和二姨父。表嫂，也就是那个女工，抱​着他们三岁的儿子，说起了他们的罗曼史，盛赞表哥文笔不错，当年写的情书如何如何板扎，深深打动了她的心！然后声情并茂的背诵了几大段给我听。。我惊呆了！特么的，那不是当年劳资写的吗，怎么变成表哥的了？！。。。​
骑着二哈啃黄瓜,部门有个重要岗位的菇凉急辞，我心里急着招人移交她的工作。面试了五六个，感觉有一个很不错，为了让她早点入职，在人事通知她明天入职后，我感觉怕她不来，私底下又给你打了个电话鼓励她明天早点来。这不，今天告诉我们不来了，说本来她想来报到的，但是我们这里太热情了，她怀疑我们是搞船消和炸片的。。。
